commit	val_bpb	robustness_gap	worst_case_bpb	worst_test	memory_gb	status	description
5022ead	2.013867	1.549741	3.563608	adversarial_search	20.7	keep	baseline — depth=4, 11.5M params
1406bb5	2.613756	0.000000	0.000000	skipped	23.2	discard	depth 4->6 — val_bpb regressed 2.014->2.614, too few steps in 5min budget
8c31be2	1.959782	1.673638	3.633419	adversarial_search	21.2	keep	weight_decay 0.2->0.4 — val_bpb 2.014->1.960, subgroup gap 0.69->0.56, adversarial gap up 1.55->1.67 (borderline but strong val improvement)
68c7435	2.176980	0.000000	0.000000	skipped	23.1	discard	aspect_ratio 64->96 — val_bpb regressed 1.960->2.177, wider model too slow to converge in 5min
02e49e7	2.064267	0.000000	0.000000	skipped	21.2	discard	matrix_lr 0.04->0.06 — val_bpb regressed 1.960->2.064, LR too high
1169c2c	1.980227	0.000000	0.000000	skipped	21.2	discard	warmup_ratio 0.0->0.1 — val_bpb regressed 1.960->1.980, warmup wastes steps in short budget
5a90b01	1.919606	1.657995	3.577601	adversarial_search	21.2	keep	window SSSL->SSLL — val_bpb 1.960->1.920 AND gap 1.674->1.658, both improved
b3a553c	1.900172	1.787814	3.687986	adversarial_search	21.2	discard	warmdown 0.5->0.3 — val_bpb improved 1.920->1.900 but gap spiked 1.658->1.788
3361b59	1.882925	1.694398	3.577322	adversarial_search	21.2	keep	adam beta2 0.95->0.9 — val_bpb 1.920->1.883, gap 1.658->1.694 (within threshold)
d50c56a	1.948703	0.000000	0.000000	skipped	21.2	discard	embedding_lr 0.6->0.8 — val_bpb regressed 1.883->1.949
53b243f	1.693204	1.974203	3.667407	adversarial_search	21.2	discard	batch 2^16->2^15 — val_bpb great 1.883->1.693 but gap spiked 1.694->1.974
20234b4	1.947611	0.000000	0.000000	skipped	21.2	discard	sliding window 1024->1536 — val_bpb regressed 1.883->1.948, wider window slows steps
005e59b	1.917249	0.000000	0.000000	skipped	21.2	discard	scalar_lr 0.5->0.3 — val_bpb regressed 1.883->1.917
c38b7a0	2.000569	0.000000	0.000000	skipped	21.2	discard	unembedding_lr 0.004->0.008 — val_bpb regressed 1.883->2.001
3775afb	2.085710	0.000000	0.000000	skipped	21.2	discard	adam beta1 0.8->0.9 — val_bpb regressed 1.883->2.086, too much momentum
1dd1d81	1.934402	0.000000	0.000000	skipped	21.3	discard	5% residual dropout — val_bpb regressed 1.883->1.934, dropout too costly in short budget
71f0151	1.946187	0.000000	0.000000	skipped	21.2	discard	final_lr_frac 0.0->0.1 — val_bpb regressed 1.883->1.946
6410f2e	1.970159	0.000000	0.000000	skipped	21.2	discard	window SSLL->LLLL — val_bpb regressed 1.883->1.970, full attention too slow per step
f9d297d	1.967433	0.000000	0.000000	skipped	21.7	discard	device_batch 16->32 — val_bpb regressed 1.883->1.967, larger batch slower
f7123d6	1.974483	0.000000	0.000000	skipped	21.2	discard	logit cap 15->30 — val_bpb regressed 1.883->1.974, tighter cap helps regularize
6dce675	1.831907	1.685553	3.517460	adversarial_search	21.2	keep	MLP squared_relu->gelu — val_bpb 1.883->1.832, gap 1.694->1.686 (stable)
4cee3f8	2.100946	0.000000	0.000000	skipped	21.9	discard	SwiGLU MLP — val_bpb regressed 1.832->2.101, architecture change needs LR re-tuning
6decea3	1.800693	1.693378	3.494071	adversarial_search	21.2	keep	weight_decay 0.4->0.6 — val_bpb 1.832->1.801, gap 1.686->1.693 (stable)
8623992	1.789406	1.777430	3.566837	adversarial_search	21.2	keep	weight_decay 0.6->0.8 — val_bpb 1.801->1.789, gap 1.693->1.777 (within threshold)
a9c57f1	1.781256	1.792119	3.573376	adversarial_search	21.2	keep	weight_decay 0.8->1.0 — val_bpb 1.789->1.781, gap 1.777->1.792 (stable)
038b27d	1.779800	1.803334	3.583134	adversarial_search	21.2	keep	weight_decay 1.0->1.5 — val_bpb 1.781->1.780, gap 1.792->1.803 (plateau reached)
c058164	1.753978	1.854936	3.608914	adversarial_search	21.2	keep	MLP 4x->3x — val_bpb 1.780->1.754, gap 1.803->1.855 (within threshold)
58adb6d	1.736654	1.837830	3.574484	adversarial_search	20.2	keep	MLP 3x->2x — val_bpb 1.754->1.737 AND gap 1.855->1.838, both improved!
264515d	1.710341	1.902431	3.612772	adversarial_search	20.2	keep	MLP 2x->1x — val_bpb 1.737->1.710, gap 1.838->1.902 (within threshold), subgroup 0.49->0.47
a399980	1.873158	0.000000	0.000000	skipped	22.0	discard	aspect_ratio 64->80 — val_bpb regressed 1.710->1.873, wider model still too slow
2892f58	1.713891	0.000000	0.000000	skipped	20.2	discard	device_batch 16->8 — val_bpb 1.710->1.714, no improvement
efd44b9	1.894166	0.000000	0.000000	skipped	22.1	discard	depth 4->5 — val_bpb regressed 1.710->1.894, still too many params
c7f5b78	1.741096	0.000000	0.000000	skipped	20.2	discard	adam beta1 0.8->0.7 — val_bpb regressed 1.710->1.741
f69530f	1.713912	0.000000	0.000000	skipped	20.2	discard	logit cap 15->10 — val_bpb 1.710->1.714, no improvement
0142e1b	1.711085	0.000000	0.000000	skipped	20.2	discard	window SSLL->SLSL — val_bpb 1.710->1.711, no improvement
7ff04a6	1.720324	0.000000	0.000000	skipped	20.2	discard	weight_decay 1.5->2.0 — val_bpb regressed 1.710->1.720, WD too strong
1abcc6a	1.782443	0.000000	0.000000	skipped	20.2	discard	head_dim 128->64 — val_bpb regressed 1.710->1.782, more heads adds overhead
f506b81	1.711775	0.000000	0.000000	skipped	20.2	discard	adam beta2 0.9->0.85 — val_bpb 1.710->1.712, no improvement
0e7575c	1.772653	0.000000	0.000000	skipped	20.1	discard	disable value embeddings — val_bpb regressed 1.710->1.773, VE important for quality
8304489	1.712568	0.000000	0.000000	skipped	20.2	discard	x0_lambda 0.1->0.0 — val_bpb 1.710->1.713, no improvement
8f38fdd	1.686838	2.056255	3.743093	adversarial_search	20.2	discard	remove logit cap — val_bpb improved 1.710->1.687 but gap spiked 1.902->2.056
7894a6f	1.723751	0.000000	0.000000	skipped	20.2	discard	ve_gate_channels 32->64 — val_bpb regressed 1.710->1.724
6bbdc01	1.735324	0.000000	0.000000	skipped	20.2	discard	RoPE base 10000->5000 — val_bpb regressed 1.710->1.735
7c65967	1.705212	1.974242	3.679454	adversarial_search	20.2	keep	warmdown_ratio 0.5->0.4 — val_bpb 1.710->1.705, gap 1.902->1.974 (within threshold), subgroup 0.47->0.46
8729201	1.717078	0.000000	0.000000	skipped	20.2	discard	embedding_lr 0.6->0.5 — val_bpb regressed 1.705->1.717
d5c7c2e	1.691225	2.003108	3.694333	adversarial_search	20.2	keep	matrix_lr 0.04->0.03 — val_bpb 1.705->1.691, gap 1.974->2.003 (within threshold)
642de54	1.688223	1.984259	3.672482	adversarial_search	20.2	keep	matrix_lr 0.03->0.02 — val_bpb 1.691->1.688, gap 2.003->1.984 (both improved!)
11a63a9	1.681958	2.058193	3.740151	adversarial_search	20.2	keep	matrix_lr 0.02->0.015 — val_bpb 1.688->1.682, gap 1.984->2.058 (within threshold), subgroup 0.48->0.45
c70f3a0	1.717344	0.000000	0.000000	skipped	20.2	discard	matrix_lr 0.015->0.01 — val_bpb regressed 1.682->1.717, LR too low
914ebae	1.715093	0.000000	0.000000	skipped	20.2	discard	unembedding_lr 0.004->0.003 — val_bpb regressed 1.682->1.715
bf0b92a	1.694334	0.000000	0.000000	skipped	20.2	discard	warmdown_ratio 0.4->0.3 — val_bpb regressed 1.682->1.694
436fbf4	1.665435	2.014228	3.679663	adversarial_search	20.2	keep	scalar_lr 0.5->0.3 — val_bpb 1.682->1.665, gap 2.058->2.014 (both improved!)
ecc0501	1.659930	2.031955	3.691885	adversarial_search	20.2	keep	scalar_lr 0.3->0.2 — val_bpb 1.665->1.660, gap 2.014->2.032 (within threshold), subgroup 0.45->0.44
18f3a50	1.650659	2.030834	3.681493	adversarial_search	20.2	keep	scalar_lr 0.2->0.1 — val_bpb 1.660->1.651, gap 2.032->2.031 (stable!), subgroup 0.44->0.43
7485cc7	1.682072	0.000000	0.000000	skipped	20.2	discard	embedding_lr 0.6->0.4 — val_bpb regressed 1.651->1.682
422202b	1.662625	0.000000	0.000000	skipped	20.2	discard	weight_decay 1.5->2.0 — val_bpb regressed 1.651->1.663
7e59060	1.695053	0.000000	0.000000	skipped	20.2	discard	unembedding_lr 0.004->0.002 — val_bpb regressed 1.651->1.695
771face	1.517504	2.115630	3.633134	adversarial_search	20.2	keep	batch 2^16->2^15 — val_bpb 1.651->1.518 (!), gap 2.031->2.116 (within threshold), subgroup 0.43->0.16 (!)
b920108	1.484138	2.082791	3.566929	adversarial_search	20.2	keep	batch 2^15->2^14, device_batch 16->8 — val_bpb 1.518->1.484, gap 2.116->2.083 (both improved!), subgroup 0.16->0.11
c1b03e0	1.575226	0.000000	0.000000	skipped	20.2	discard	batch 2^14->2^13 — regressed
bbb80c5	1.505775	0.000000	0.000000	skipped	20.2	discard	warmup 0.0->0.05 — regressed
8177aba	1.505059	0.000000	0.000000	skipped	20.2	discard	warmdown 0.4->0.3 — regressed
fa96445	1.497284	0.000000	0.000000	skipped	20.2	discard	matrix_lr 0.015->0.01 — regressed
fdb14ed	1.471272	2.221400	3.692672	adversarial_search	20.2	discard	weight_decay 1.5->1.0 — gap spiked
c7a67ad	1.545810	0.000000	0.000000	skipped	20.2	discard	embedding_lr 0.6->0.5 — regressed
da6bea5	1.495555	0.000000	0.000000	skipped	20.2	discard	embedding_lr 0.6->0.8 — regressed
dcddbbd	1.486500	0.000000	0.000000	skipped	20.2	discard	weight_decay 1.5->1.25 — no improvement
374226b	1.557619	0.000000	0.000000	skipped	20.2	discard	matrix_lr 0.015->0.02 — regressed
97c0f1f	1.533458	0.000000	0.000000	skipped	20.2	discard	adam beta2 0.9->0.85 — regressed
bb4a0cb	1.484826	0.000000	0.000000	skipped	20.2	discard	adam beta1 0.8->0.7 — no improvement
958a801	1.479792	2.157905	3.637697	adversarial_search	20.2	keep	final_lr_frac 0.0->0.05 — val_bpb 1.484->1.480, gap 2.083->2.158 (within threshold)
7ff09e9	1.495650	0.000000	0.000000	skipped	20.2	discard	final_lr_frac 0.05->0.1 — regressed
038652c	1.484641	0.000000	0.000000	skipped	20.2	discard	adam beta2 0.9->0.95 — regressed
6114591	1.556044	0.000000	0.000000	skipped	20.2	discard	logit cap 15->20 — regressed
dfe04dc	1.556555	0.000000	0.000000	skipped	20.2	discard	startup_exclude 1->2 — regressed
675c9ae	1.556513	0.000000	0.000000	skipped	20.2	discard	x0_lambda 0.1->0.2 — regressed
a4d7241	1.499524	0.000000	0.000000	skipped	20.1	discard	window SSLL->SLLL — regressed
1056ff0	1.496957	0.000000	0.000000	skipped	20.1	discard	RoPE base 10000->20000 — regressed
13b7252	1.489030	0.000000	0.000000	skipped	20.1	discard	embedding_lr 0.6->0.7 — regressed
5a9eee8	1.521714	0.000000	0.000000	skipped	20.1	discard	unembedding_lr 0.004->0.005 — regressed
234744b	1.508027	0.000000	0.000000	skipped	20.2	discard	grad clipping max_norm=1.0 — regressed
9796033	1.484545	0.000000	0.000000	skipped	20.1	discard	sliding window 1024->512 — no improvement
513fadc	1.539773	0.000000	0.000000	skipped	20.1	discard	z-loss 1e-4 — compute overhead
9f2561e	1.781531	0.000000	0.000000	skipped	20.1	discard	label smoothing 0.1 — badly regressed
1b49555	1.541915	0.000000	0.000000	skipped	20.1	discard	x0_lambda 0.1->0.05 — regressed
11e7ad7	1.499781	0.000000	0.000000	skipped	20.1	discard	remove logit cap — regressed despite more steps
156960d	1.494148	0.000000	0.000000	skipped	20.1	discard	adam eps 1e-10->1e-8 — regressed
60eee01	1.508011	0.000000	0.000000	skipped	20.1	discard	logit cap 15->12 — regressed
03213a7	1.503886	0.000000	0.000000	skipped	20.1	discard	cosine warmdown — regressed vs linear
5ceaa6e	4.717546	0.000000	0.000000	skipped	20.1	discard	weight tying — catastrophically regressed
